{
  "schemaVersion": 1,
  "id": "domain",
  "enabled": false,
  "publicOrigin": "https://humanware.example",
  "privateOrigin": "https://os.humanware.example",
  "deployment": {
    "adapter": "caddy-local",
    "networkPolicy": "private"
  },
  "routes": [
    {
      "id": "status",
      "visibility": "private",
      "mount": "/status",
      "source": "framework:status",
      "data": "data:generated/status/current.json"
    },
    {
      "id": "artifacts",
      "visibility": "private",
      "mount": "/artifacts",
      "source": "framework:artifacts",
      "data": "data:artifacts"
    },
    {
      "id": "sessions",
      "visibility": "private",
      "mount": "/sessions/",
      "source": "framework-static:sessions",
      "data": "data:generated/sessions/current.json"
    },
    {
      "id": "activity",
      "visibility": "private",
      "mount": "/activity/",
      "source": "framework-static:activity",
      "data": "data:generated/indexes/activity"
    }
  ]
}
